{
  "total": 20,
  "succeeded": 19,
  "failed": 1,
  "skipped": 0,
  "fallback": 0,
  "started_at": "2026-07-20T04:13:44Z",
  "finished_at": "2026-07-20T05:45:12Z",
  "duration_seconds": 5488.2,
  "backend": "transformers",
  "platform": "linux-rocm",
  "model_revision": "c37c62768c644bb594da4283149c627765aa80f3",
  "dataset_revision": "aa1ee96d106dbe53d0ae59474d75c6e6d9b53fec",
  "output_dir": "/root/workspace/Dolphin-v2-ROCm/results/omnidocbench/v16/linux-rocm-canary",
  "config_digest": "sha256:fee23a0928442a4fb946ba52b00fa9c44f5cfca23d661e0a91d547c5dd800eb4",
  "model_load_seconds": 4.15,
  "pages_missing_records": [],
  "output_completeness": {
    "pages": 20,
    "markdown_files": 20,
    "explicit_failures": 1,
    "missing": [],
    "empty": [],
    "complete": true
  }
}